{
  "schema_version": 1,
  "id": "fixture-crossroads",
  "name": "crossroads guard",
  "events": [
    {
      "at_step": 1,
      "line": "You stand at a crossroads.",
      "matches": "crossroads",
      "expect": null
    },
    {
      "at_step": 2,
      "line": "A guard bars the north exit.",
      "matches": "guard",
      "expect": "blocked north"
    }
  ]
}
